Unnamed: 0,batter,baller,ball_speed,ball_length,ball_swing,wicket,wide,runs,shot,commentary
0,Shami,Tanzim Hasan Sakib,,full,straight,1,0,0,cover drive,"Tanzim Hasan Sakib to Shami, out Shami Run Out,, 1 run completed"
1,Shami,Tanzim Hasan Sakib,,full,straight,0,0,4,cover drive,"Tanzim Hasan Sakib to Shami, FOUR, the game just about alive"
2,Shami,Tanzim Hasan Sakib,,full,straight,0,0,0,cover drive,"Tanzim Hasan Sakib to Shami, no run, third dot in a row"
3,Shami,Tanzim Hasan Sakib,,full,straight,0,0,0,flick,"Tanzim Hasan Sakib to Shami, no run, slower ball and well bowled outside off, Shami slogs and misses"
4,Shami,Tanzim Hasan Sakib,,full,straight,0,0,0,drive,"Tanzim Hasan Sakib to Shami, no run, dug in short on the stumps, Shami pulls and misses, hit on the helmet I think"
5,Pathirana,Kuldeep Yadav,,full,straight,1,0,0,defend,"Kuldeep Yadav to Pathirana, out Bowled,, Poor shot and India win"
6,Pathirana,Kuldeep Yadav,,full,straight,0,0,0,flick,"Kuldeep Yadav to Pathirana, no run, keeps low and turns in on the stumps, Pathirana does well to turn it to square leg"
7,Rajitha,Kuldeep Yadav,,full,straight,1,0,0,defend,"Kuldeep Yadav to Rajitha, out Bowled,, What a googly and knocked over"
8,Rajitha,Hardik Pandya,,full,straight,0,0,1,drive,"Hardik Pandya to Rajitha, 1 run, full and snaking back in on middle, flicked to mid-wicket and Rajitha is away"
9,Theekshana,Hardik Pandya,,full,straight,1,0,0,drive,"Hardik Pandya to Theekshana, out Caught by (sub)Suryakumar Yadav,, Fantastic catch and it is SKY"
10,Theekshana,Hardik Pandya,,full,straight,0,0,0,drive,"Hardik Pandya to Theekshana, no run, another grunty effort-filled length delivery from Hardik Pandya, on the stumps, defended to cover"
11,Theekshana,Hardik Pandya,,full,straight,0,0,0,drive,"Hardik Pandya to Theekshana, no run, back of a length on the stumps, 136kph and tight, Theekshana defends off the back foot"
12,Wellalage,Hardik Pandya,,full,straight,0,0,1,drive,"Hardik Pandya to Wellalage, 1 run, back of a length outside off, Wellalage punches to sweeper cover"
13,Wellalage,Hardik Pandya,,full,straight,0,0,0,flick,"Hardik Pandya to Wellalage, no run, full and wide outside off, Wellalage goes for a big loft and misses"
14,Theekshana,Hardik Pandya,,full,outside,0,0,1,cut,"Hardik Pandya to Theekshana, 1 run, good length on off, pushed to extra-cover and it's an easy single"
15,Theekshana,Hardik Pandya,,full,straight,0,0,0,defend,"Hardik Pandya to Theekshana, no run, dug in short at Theekshana who bends his head and lets it go"
16,Theekshana,Hardik Pandya,,full,straight,0,0,0,leave,"Hardik Pandya to Theekshana, no run, good stop by Kohli at cover, saves a run"
17,Theekshana,Hardik Pandya,,full,straight,0,0,0,cover drive,"Hardik Pandya to Theekshana, no run, wide of the crease and angling into middle and leg, nudged to mid-wicket"
18,Wellalage,Hardik Pandya,,full,leg,0,0,1,flick,"Hardik Pandya to Wellalage, 1 run, fullish around off, Wellalage opens the face of the bat and runs it down to third man"
19,Wellalage,Hardik Pandya,,full,straight,0,0,4,flick,"Hardik Pandya to Wellalage, FOUR, the luck is with Wellalage"
20,Dhananjaya,Hardik Pandya,,full,straight,0,0,0,cover drive,"Hardik Pandya to Dhananjaya, no run, lovely delivery, wide of the crease and back of a length outside off, extra bounce too, Dhananjaya tries to run it down and misses"
21,Dhananjaya,Hardik Pandya,,full,straight,0,0,0,defend,"Hardik Pandya to Dhananjaya, no run, full outside off, Dhananjaya gets forward to drive to mid-off"
22,Dhananjaya,Hardik Pandya,137.0,full,straight,0,0,0,defend,"Hardik Pandya to Dhananjaya, no run, back of a length on the stumps, 137kph, Dhananjaya goes on the back foot to defend"
23,Wellalage,Hardik Pandya,,full,straight,0,0,1,drive,"Hardik Pandya to Wellalage, 1 run, back of a length outside off, Wellalage stands tall to punch to sweeper cover"
24,Wellalage,Hardik Pandya,,full,straight,0,0,0,drive,"Hardik Pandya to Wellalage, no run, good length and tight on the stumps, defended"
25,Wellalage,Hardik Pandya,,full,straight,0,0,0,drive,"Hardik Pandya to Wellalage, no run, dug in short outside off, left alone"
26,Wellalage,Hardik Pandya,,full,straight,0,0,0,drive,"Hardik Pandya to Wellalage, no run, nice delivery and Hardik Pandya follows through near Wellalage after beating him"
27,Wellalage,Hardik Pandya,,full,straight,0,0,0,drive,"Hardik Pandya to Wellalage, no run, full outside off, moving away, left alone"
28,Wellalage,Hardik Pandya,,full,outside,0,0,0,defend,"Hardik Pandya to Wellalage, no run, fullish outside off, angling away from Wellalage who hides the bat inside the pad to leave"
29,Dhananjaya,Hardik Pandya,,full,leg,0,0,1,flick,"Hardik Pandya to Dhananjaya, 1 run, good length just outside off, Dhananjaya runs it down to third man"
30,Dhananjaya,Hardik Pandya,,full,straight,0,0,0,defend,"Hardik Pandya to Dhananjaya, no run, beautiful delivery"
31,Wellalage,Hardik Pandya,,full,leg,0,0,1,flick,"Hardik Pandya to Wellalage, 1 run, slower ball off-cutter on a length on the stumps, Wellalage runs it down to third man"
32,Wellalage,Kuldeep Yadav,,full,straight,0,0,2,cover drive,"Kuldeep Yadav to Wellalage, 2 runs, right in between three fielders at deep mid-wicket"
33,Wellalage,Kuldeep Yadav,,full,straight,0,0,0,drive,"Kuldeep Yadav to Wellalage, no run, tossed up fullish on the stumps, Wellalage goes on the back foot and nudges to slip, did not pick it off the hand, did so off the pitch"
34,Wellalage,Kuldeep Yadav,,full,outside,0,0,6,drive,"Kuldeep Yadav to Wellalage, SIX, wow, Look at that shot and look at the reaction from Kuldeep Yadav who goes - that was good, The slogsweep from the stumps and clears the deep mid-wicket fence with ease"
35,Wellalage,Kuldeep Yadav,,full,straight,0,0,0,flick,"Kuldeep Yadav to Wellalage, no run, confusion between both but all's well in the end"
36,Wellalage,Kuldeep Yadav,,full,outside,0,0,2,defend,"Kuldeep Yadav to Wellalage, 2 runs, this is short and wide outside off, cut wide of sweeper cover for two"
37,Wellalage,Kuldeep Yadav,,full,straight,0,0,0,defend,"Kuldeep Yadav to Wellalage, no run, Wellalage wanted to come down or at least feigned to do so, but the length is shortened and the ball turns past the bat"
38,Wellalage,Kuldeep Yadav,,full,outside,0,0,1,flick,"Kuldeep Yadav to Wellalage, 1 run, Wellalage comes down the track and pushes it past Kuldeep Yadav for one"
39,Wellalage,Kuldeep Yadav,,full,outside,0,0,0,defend,"Kuldeep Yadav to Wellalage, no run, slower and spin outside off, Wellalage looks to punch and misses"
40,Wellalage,Kuldeep Yadav,,full,straight,0,0,0,defend,"Kuldeep Yadav to Wellalage, no run, fullish on off, steered to backward point"
41,Wellalage,Kuldeep Yadav,,full,outside,0,0,2,defend,"Kuldeep Yadav to Wellalage, 2 runs, short and wide outside off, cut wide of sweeper cover and it's an easy two"
42,Wellalage,Kuldeep Yadav,,full,outside,0,0,4,defend,"Kuldeep Yadav to Wellalage, FOUR, Wellalage is not going to hang back"
43,Dhananjaya,Kuldeep Yadav,,full,straight,0,0,1,defend,"Kuldeep Yadav to Dhananjaya, 1 run, flat good length on the stumps, Dhananjaya sinks low and smites to deep square leg"
44,Dhananjaya,Kuldeep Yadav,,full,straight,0,0,0,defend,"Kuldeep Yadav to Dhananjaya, leg byes, 1 run, sliding down leg, Dhananjaya flicks and misses, off the pad for a legbye"
45,Dhananjaya,Kuldeep Yadav,,full,straight,0,0,0,defend,"Kuldeep Yadav to Dhananjaya, no run, another flatter delivery on the stumps, turned to square leg"
46,Dhananjaya,Kuldeep Yadav,,full,straight,0,0,0,defend,"Kuldeep Yadav to Dhananjaya, no run, flat good length on the stumps, defended off the back foot to mid-wicket"
47,Shanaka,Kuldeep Yadav,,full,outside,0,0,1,drive,"Kuldeep Yadav to Shanaka, 1 run, flat length delivery on off, Shanaka goes on the back foot to punch to long-on"
48,Shanaka,Kuldeep Yadav,,full,outside,0,0,0,defend,"Kuldeep Yadav to Shanaka, no run, Shanaka is very lucky"
49,Shanaka,Kuldeep Yadav,,full,straight,0,0,0,defend,"Kuldeep Yadav to Shanaka, no run, superb delivery, tossed up and goes the other way outside off as Shanaka going back to defend is beaten"
50,Dhananjaya,Kuldeep Yadav,,full,straight,0,0,0,defend,"Kuldeep Yadav to Dhananjaya, no run, tossed up on off, Dhananjaya defends to the off-side"
51,Dhananjaya,Kuldeep Yadav,,full,straight,0,0,2,defend,"Kuldeep Yadav to Dhananjaya, 2 runs, leg-lined delivery, Dhananjaya nurdles it backward of square leg and scampers back for the second"
52,Dhananjaya,Kuldeep Yadav,,full,straight,0,0,2,defend,"Kuldeep Yadav to Dhananjaya, 2 runs, slower and turns in, Dhananjaya goes for the sweep and the top-edge balloons over leg slip, Jadeja tidies up"
53,Dhananjaya,Kuldeep Yadav,,full,straight,0,0,0,defend,"Kuldeep Yadav to Dhananjaya, no run, drifts across off, Dhananjaya attempts the sweep and plays over it, beaten on the under-edge"
54,Dhananjaya,Kuldeep Yadav,,full,straight,0,0,0,defend,"Kuldeep Yadav to Dhananjaya, no run, flighted on off, Dhananjaya prods forward and defends"
55,Dhananjaya,Kuldeep Yadav,,full,straight,0,0,0,defend,"Kuldeep Yadav to Dhananjaya, no run, fraction short and Dhananjaya misses the flick to the leg-side, struck high on the pad"
56,Dhananjaya,Kuldeep Yadav,,full,straight,0,0,1,defend,"Kuldeep Yadav to Dhananjaya, 1 run, slower but length is short, Dhananjaya tucks it round the corner"
57,Shanaka,Kuldeep Yadav,,full,outside,0,0,1,cover drive,"Kuldeep Yadav to Shanaka, 1 run, short of length around leg-stump, Shanaka punches it to deep mid-wicket"
58,Shanaka,Kuldeep Yadav,,full,straight,0,0,0,pull,"Kuldeep Yadav to Shanaka, no run, touch quicker on off, Shanaka defends it back to Kuldeep"
59,Shanaka,Kuldeep Yadav,,full,outside,0,0,4,defend,"Kuldeep Yadav to Shanaka, FOUR, offered a gift first up and Shanaka accepts it happily"
60,Asalanka,Kuldeep Yadav,,short,outside,1,0,0,flick,"Kuldeep Yadav to Asalanka, out Caught by Rahul,, Second wicket for Kuldeep and he has sent back both set batters"
61,Asalanka,Kuldeep Yadav,,full,straight,0,0,0,defend,"Kuldeep Yadav to Asalanka, no run, tossed up close to off, Asalanka blocks to the off-side"
62,Dhananjaya,Kuldeep Yadav,,full,straight,0,0,1,defend,"Kuldeep Yadav to Dhananjaya, 1 run, slower but fraction short, Dhananjaya nudges it to deep square leg"
63,Dhananjaya,Kuldeep Yadav,,full,straight,0,0,0,defend,"Kuldeep Yadav to Dhananjaya, no run, spinning into the hips, Dhananjaya tucks it towards leg slip and Gill makes a fine stop"
64,Dhananjaya,Kuldeep Yadav,,full,straight,0,0,0,defend,"Kuldeep Yadav to Dhananjaya, no run, floated up outside off, Dhananjaya pushes off the inner half to mid-wicket"
65,Samarawickrama,Kuldeep Yadav,,full,straight,1,0,0,defend,"Kuldeep Yadav to Samarawickrama, out Stumped,, There's the wicket India desperately needed"
66,Samarawickrama,Kuldeep Yadav,,full,outside,0,0,0,flick,"Kuldeep Yadav to Samarawickrama, no run, half an apppeal for LBW"
67,Asalanka,Kuldeep Yadav,,full,straight,0,0,1,drive,"Kuldeep Yadav to Asalanka, 1 run, short and turning away, Asalanka late cuts and Jadeja makes an important interception near short third"
68,Samarawickrama,Kuldeep Yadav,,full,leg,0,0,0,flick,"Kuldeep Yadav to Samarawickrama, no run, comes down the track and misses the flick, rapped on the pads but the ball was spinning"
69,Asalanka,Kuldeep Yadav,,full,straight,0,0,1,drive,"Kuldeep Yadav to Asalanka, 1 run, tossed up on middle, Asalanka nudges it to square leg"
70,Samarawickrama,Kuldeep Yadav,,full,straight,0,0,1,defend,"Kuldeep Yadav to Samarawickrama, 1 run, nurdled with the spin backward of square leg"
71,Samarawickrama,Kuldeep Yadav,,full,straight,0,0,2,drive,"Kuldeep Yadav to Samarawickrama, 2 runs, short and drifted across, Samarawickrama cracks it in front of square and Axar stops it with his boot, the pair are content with a brace"
72,Asalanka,Kuldeep Yadav,,full,outside,0,0,1,cover drive,"Kuldeep Yadav to Asalanka, 1 run, flighted outside off, Asalanka opens the bat face and eases it past cover"
73,Samarawickrama,Kuldeep Yadav,,full,leg,0,0,1,flick,"Kuldeep Yadav to Samarawickrama, 1 run, spinning into leg-stump, Samarawickrama glances it to fine leg"
74,Samarawickrama,Kuldeep Yadav,,full,outside,0,0,0,cover drive,"Kuldeep Yadav to Samarawickrama, no run, very full delivery outside off, Samarawickrama digs the drive towards cover"
75,Samarawickrama,Kuldeep Yadav,,full,outside,0,0,0,defend,"Kuldeep Yadav to Samarawickrama, no run, tossed up around off, Samarawickrama drives it back to Kuldeep"
76,Asalanka,Kuldeep Yadav,,full,straight,0,0,1,drive,"Kuldeep Yadav to Asalanka, 1 run, floated up on leg-stump, Asalanka nudges it to the vacant mid-wicket region"
77,Asalanka,Kuldeep Yadav,,full,outside,0,0,0,defend,"Kuldeep Yadav to Asalanka, no run, slower and turning away, Asalanka directs it towards point"
78,Samarawickrama,Kuldeep Yadav,,full,straight,0,0,1,defend,"Kuldeep Yadav to Samarawickrama, 1 run, comes down the track and works it with the spin to long-on"
79,Asalanka,Kuldeep Yadav,,full,straight,0,0,3,flick,"Kuldeep Yadav to Asalanka, 3 runs, flighted on off, Asalanka drags the sweep to fine leg and it is a long chase for a returning Bumrah, he gets there and manages to keep it in before the boundary rope"
80,Samarawickrama,Kuldeep Yadav,,full,outside,0,0,0,drive,"Kuldeep Yadav to Samarawickrama, no run, drifted across off, Samarawickrama opens his front hip and pushes to mid-off"
81,Samarawickrama,Kuldeep Yadav,,full,leg,0,0,0,flick,"Kuldeep Yadav to Samarawickrama, no run, slower and spinning in, Samarawickrama turns it gently to mid-wicket"
82,Samarawickrama,Kuldeep Yadav,,full,straight,0,0,0,defend,"Kuldeep Yadav to Samarawickrama, no run, turning into the right hander, Samarawickrama works it to backward square"
83,Asalanka,Kuldeep Yadav,,full,outside,0,0,0,defend,"Kuldeep Yadav to Asalanka, byes, 1 run, goes for the sweep and Asalanka misses, the ball stays low and hits Rahul on the pad before deflecting"
84,Asalanka,Kuldeep Yadav,,full,outside,0,0,0,defend,"Kuldeep Yadav to Asalanka, no run, India lose a review"
85,Samarawickrama,Kuldeep Yadav,,full,straight,0,0,1,cover drive,"Kuldeep Yadav to Samarawickrama, 1 run, flighted but short of length, Samarawickrama nurdles it to square leg"
86,Asalanka,Hardik Pandya,,full,straight,0,0,0,drive,"Hardik Pandya to Asalanka, no run, 130ks delivery around off, Asalanka taps it in front of cover"
87,Asalanka,Hardik Pandya,,full,straight,0,0,0,drive,"Hardik Pandya to Asalanka, no run, 131ks fuller and close to off, Asalanka blocks it to cover"
88,Asalanka,Hardik Pandya,,full,straight,0,0,0,drive,"Hardik Pandya to Asalanka, no run, 118ks slower ball on off, Asalanka plays it with soft hands to cover"
89,Samarawickrama,Hardik Pandya,,full,straight,0,0,1,defend,"Hardik Pandya to Samarawickrama, 1 run, fuller and in the channel, Samarawickrama prods forward and squirts an inside edge to fine leg"
90,Samarawickrama,Hardik Pandya,,full,straight,0,0,0,drive,"Hardik Pandya to Samarawickrama, no run, 128ks back of a length on off, Samarawickrama turns it to mid-on"
91,Samarawickrama,Hardik Pandya,,full,straight,0,0,2,drive,"Hardik Pandya to Samarawickrama, 2 runs, good length ball outside off, Samarawickrama pushes it in front of square on the off-side and Kishan races across from sweeper cover but can't prevent the second"
92,Kusal Mendis,Bumrah,,length,outside,1,0,0,defend,"Bumrah to Kusal Mendis, out Caught by (sub)Suryakumar Yadav,, Mendis knew"
93,Kusal Mendis,Bumrah,,length,outside,0,0,0,defend,"Bumrah to Kusal Mendis, no run, 140ks very full and close to yorker length, Mendis digs it back to Bumrah"
94,Kusal Mendis,Bumrah,,length,outside,0,0,0,defend,"Bumrah to Kusal Mendis, no run, short and banged into the wicket, Mendis looks to upper cut but the ball goes past the top-edge"
95,Kusal Mendis,Bumrah,,length,outside,0,0,4,defend,"Bumrah to Kusal Mendis, FOUR, that's more like it"
96,Kusal Mendis,Bumrah,,length,straight,0,0,1,defend,"Bumrah to Kusal Mendis, 1 run, angled in on middle and leg, Mendis tucks it wide of mid-wicket and rushes to the other end"
97,Kusal Mendis,Bumrah,,length,outside,0,0,0,defend,"Bumrah to Kusal Mendis, no run, 141ks short of length delivery, Mendis rides the bounce and punches to backward point"
98,Kusal Mendis,Bumrah,,length,outside,0,0,4,defend,"Bumrah to Kusal Mendis, FOUR, streaky, Mendis goes for a wild slog across the line and the top-edge flies over the slip cordon"
99,Kusal Mendis,Bumrah,,length,straight,0,0,0,defend,"Bumrah to Kusal Mendis, no run, good length ball close to off, Mendis knocks it on top of the bounce to cover"
100,Kusal Mendis,Siraj,,full,straight,0,0,1,defend,"Siraj to Kusal Mendis, 1 run, in the air and short of Gill"
101,Kusal Mendis,Siraj,,length,outside,0,0,1,cut,"Siraj to Kusal Mendis, 1 run, good length ball outside off, Mendis is unsure to play or not and in the end he's late in lifting his bat, steers it to third man"
102,Kusal Mendis,Siraj,,length,outside,0,0,4,flick,"Siraj to Kusal Mendis, FOUR, does not adjust to the right hander, drifts onto the pads and Mendis flicks it to deep square leg"
103,Kusal Mendis,Bumrah,,length,outside,0,0,0,cover drive,"Bumrah to Kusal Mendis, no run, wicket maiden, Fuller and angling in, Mendis prods forward and defends to the off-side"
104,Kusal Mendis,Bumrah,,full,outside,0,0,0,drive,"Bumrah to Kusal Mendis, no run, 136ks delivery close to off, Mendis gets behind the line and blocks to backward point"
105,Kusal Mendis,Bumrah,,length,outside,0,0,0,defend,"Bumrah to Kusal Mendis, no run, hits the bat hard with an in-angler, Mendis defends with soft hands"
106,Kusal Mendis,Bumrah,,length,outside,0,0,0,defend,"Bumrah to Kusal Mendis, no run, 138ks back of a length outside off, Mendis lifts his bat and lets it go"
107,Kusal Mendis,Bumrah,,length,outside,0,0,0,defend,"Bumrah to Kusal Mendis, no run, stifled appeal for LBW"
108,Kuldeep Yadav,Asalanka,,full,straight,1,0,0,defend,"Asalanka to Kuldeep Yadav, out Caught by Dhananjaya,, Two in two and Sri Lanka are on fire"
109,Hardik Pandya,Wellalage,,length,straight,1,0,0,drive,"Wellalage to Hardik Pandya, out Caught by Kusal Mendis,, Maiden fifer for Wellalage"
110,Hardik Pandya,Wellalage,,full,straight,0,0,0,drive,"Wellalage to Hardik Pandya, no run, full outside off, driven to cover"
111,Ishan Kishan,Asalanka,,full,straight,1,0,0,cover drive,"Asalanka to Ishan Kishan, out Caught by Wellalage,, Wellalage again"
112,Ishan Kishan,Asalanka,,full,outside,0,0,0,leave,"Asalanka to Ishan Kishan, no run, good length outside off, dabbed to backward point"
113,Hardik Pandya,Wellalage,,full,straight,0,0,0,cut,"Wellalage to Hardik Pandya, no run, full on the stumps, pushed to cover"
114,Hardik Pandya,Wellalage,,full,straight,0,0,0,defend,"Wellalage to Hardik Pandya, no run, the inside-edge onto the pads saves Hardik Pandya, gets forward to defend and gets some bat before pad"
115,Hardik Pandya,Wellalage,,full,straight,0,0,0,drive,"Wellalage to Hardik Pandya, no run, what a ripper, Unplayable"
116,Ishan Kishan,Wellalage,,length,straight,0,0,1,defend,"Wellalage to Ishan Kishan, 1 run, good length on the middle and leg line, Ishan Kishan goes on the back foot to flick through square leg"
117,Hardik Pandya,Wellalage,,full,straight,0,0,1,drive,"Wellalage to Hardik Pandya, 1 run, full outside off, Hardik Pandya opens the face of the bat to push wide of backward point"
118,Hardik Pandya,Wellalage,,full,straight,0,0,0,drive,"Wellalage to Hardik Pandya, no run, tossed up full outside off, Hardik Pandya gets outside off and misses the sweep, hit on the body"
119,Hardik Pandya,Asalanka,,full,straight,0,0,0,flick,"Asalanka to Hardik Pandya, leg byes, 1 run, Kusal Mendis appeals for a caught behind but is turned down"
120,Hardik Pandya,Asalanka,,full,outside,0,0,0,cut,"Asalanka to Hardik Pandya, no run, full on off, pushed back"
121,Ishan Kishan,Asalanka,,full,outside,0,0,1,cut,"Asalanka to Ishan Kishan, 1 run, full outside off, pushed wide of cover for a quick single"
122,Hardik Pandya,Asalanka,,full,leg,0,0,1,drive,"Asalanka to Hardik Pandya, 1 run, slower and gets sharp turn from outside off, Hardik Pandya dabs in front of short third man"
123,Hardik Pandya,Asalanka,,full,straight,0,0,0,drive,"Asalanka to Hardik Pandya, no run, flat offbreak on off, turned to mid-wicket"
124,Hardik Pandya,Asalanka,,full,straight,0,0,0,drive,"Asalanka to Hardik Pandya, no run, sharp offbreak on off-stump, Hardik Pandya gets forward to block"
125,Ishan Kishan,Wellalage,,full,straight,0,0,6,cover drive,"Wellalage to Ishan Kishan, SIX, Ishan Kishan breaks the shackles"
126,Hardik Pandya,Wellalage,,full,straight,0,0,1,drive,"Wellalage to Hardik Pandya, 1 run, good length outside off, stays low, cut to sweeper cover"
127,Ishan Kishan,Wellalage,,full,straight,0,0,1,cover drive,"Wellalage to Ishan Kishan, 1 run, full on the stumps, Ishan Kishan gets forward to flick through mid-wicket"
128,Hardik Pandya,Wellalage,,full,straight,0,0,1,drive,"Wellalage to Hardik Pandya, 1 run, full on the stumps, Hardik Pandya gets forward and uses his reach to push wide of cover"
129,Hardik Pandya,Wellalage,,full,outside,0,0,0,cover drive,"Wellalage to Hardik Pandya, no run, ripper, Wellalage goes slightly wide of the crease and bowls a tossed up delivery that drifts in on middle, brings Hardik Pandya forward and then rips past the outside-edge"
130,Hardik Pandya,Wellalage,,full,straight,0,0,0,cut,"Wellalage to Hardik Pandya, no run, full on the stumps, pushed to cover"
131,Ishan Kishan,Asalanka,,full,straight,0,0,0,cover drive,"Asalanka to Ishan Kishan, no run, wow, What a ball"
132,Ishan Kishan,Asalanka,,full,outside,0,0,0,drive,"Asalanka to Ishan Kishan, no run, flat good length outside off, cut wide of point who gets across and cuts it off"
133,Ishan Kishan,Asalanka,,full,straight,0,0,0,cover drive,"Asalanka to Ishan Kishan, no run, full on off, Ishan Kishan gets forward to push to cover"
134,Hardik Pandya,Asalanka,,full,straight,0,0,1,drive,"Asalanka to Hardik Pandya, 1 run, good length and sliding on the middle and leg line, glanced to fine-leg and Hardik Pandya is off the mark"
135,Hardik Pandya,Asalanka,,full,straight,0,0,0,drive,"Asalanka to Hardik Pandya, no run, tossed up offbreak on the stumps, Hardik Pandya gets forward to defend to mid-wicket"
136,Ishan Kishan,Asalanka,,full,straight,0,0,1,cover drive,"Asalanka to Ishan Kishan, 1 run, tossed up full outside off, Ishan Kishan drives to sweeper cover"
137,Ishan Kishan,Wellalage,,full,straight,0,0,1,cover drive,"Wellalage to Ishan Kishan, 1 run, flat length delivery on the stumps, turned to the backward square leg region"
138,Ishan Kishan,Wellalage,,full,straight,0,0,1,cover drive,"Wellalage to Ishan Kishan, 1 run, tossed up full on the stumps, driven to long-on"
139,Ishan Kishan,Wellalage,,full,straight,0,0,0,drive,"Wellalage to Ishan Kishan, no run, sliding on with the angle and going on outside off, Ishan Kishan tries to dab and misses"
140,Ishan Kishan,Dhananjaya,,full,outside,0,0,1,defend,"Dhananjaya to Ishan Kishan, 1 run, flat offbreak just outside off, Ishan Kishan goes on the back foot to pull to deep mid-wicket"
141,Ishan Kishan,Dhananjaya,,full,straight,0,0,1,defend,"Dhananjaya to Ishan Kishan, 1 run, full on the stumps, Ishan Kishan gets forward to drive to long-on"
142,Ishan Kishan,Dhananjaya,,full,leg,0,0,0,flick,"Dhananjaya to Ishan Kishan, no run, flat good length on off, Ishan Kishan guides to short third man with an open face"
143,Ishan Kishan,Wellalage,,full,straight,0,0,0,cover drive,"Wellalage to Ishan Kishan, no run, Ishan Kishan misses out there, full down leg, Ishan Kishan sweeps and picks out short fine-leg"
144,Ishan Kishan,Dhananjaya,,full,straight,0,0,0,defend,"Dhananjaya to Ishan Kishan, no run, slower and holds the length back, Kishan is drawn into the forward block and the ball spins past the outside edge"
145,Ishan Kishan,Theekshana,,full,straight,0,0,1,drive,"Theekshana to Ishan Kishan, 1 run, quicker and at the stumps, Kishan nudges it square on the leg-side"
146,Ishan Kishan,Dhananjaya,,full,straight,0,0,0,defend,"Dhananjaya to Ishan Kishan, no run, drifts in with the angle, Kishan works it straight to mid-wicket"
147,Ishan Kishan,Dhananjaya,,full,outside,0,0,0,defend,"Dhananjaya to Ishan Kishan, no run, flatter and around off, Kishan punches to cover and Samarwickrama flings the ball at the batter"
148,Ishan Kishan,Dhananjaya,,full,outside,0,0,1,defend,"Dhananjaya to Ishan Kishan, 1 run, ""catch it"" were some of the calls but luckily for Kishan the ball does not carry"
149,Ishan Kishan,Theekshana,,full,straight,0,0,1,pull,"Theekshana to Ishan Kishan, 1 run, quicker and at the stumps, Kishan nudges wide of mid-wicket"
150,Ishan Kishan,Dhananjaya,,full,outside,0,0,0,defend,"Dhananjaya to Ishan Kishan, no run, quicker and spins away sharply, Kishan looks to steer and is beaten on the outside edge"
151,Ishan Kishan,Dhananjaya,,full,outside,0,0,0,defend,"Dhananjaya to Ishan Kishan, no run, tossed up close to off, Kishan opens the bat face and directs to backward point"
152,Ishan Kishan,Dhananjaya,,full,outside,0,0,1,defend,"Dhananjaya to Ishan Kishan, 1 run, floated up teasingly, Kishan drills it back at DDS and he takes the pace off the ball, just a single"
153,Ishan Kishan,Dhananjaya,,full,straight,0,0,0,defend,"Dhananjaya to Ishan Kishan, no run, slower and drawing Kishan into the forward defensive"
154,Ishan Kishan,Dhananjaya,,full,outside,0,0,0,defend,"Dhananjaya to Ishan Kishan, no run, fraction short and drifts in, Kishan punches it firmly to mid-wicket"
155,Ishan Kishan,Theekshana,,full,outside,0,0,1,drive,"Theekshana to Ishan Kishan, 1 run, flatter and fraction short, Kishan cracks it square on the off-side"
