Unnamed: 0,batter,baller,ball_speed,ball_length,ball_swing,wicket,wide,runs,shot,commentary
156,Ishan Kishan,Theekshana,,full,outside,0,0,2,drive,"Theekshana to Ishan Kishan, 2 runs, drifted across the left hander, Kishan angles it to backward point and Asalanka fumbles, extra run conceded"
157,Ishan Kishan,Theekshana,,full,straight,0,0,0,cover drive,"Theekshana to Ishan Kishan, no run, 100ks delivery at the stumps, Kishan defends back to Theekshana"
158,Ishan Kishan,Theekshana,,full,straight,0,1,1,defend,"Theekshana to Ishan Kishan, wide, splays down leg, Kishan misses the glance and it is given as wide"
159,Ishan Kishan,Dhananjaya,,full,outside,0,0,1,defend,"Dhananjaya to Ishan Kishan, 1 run, floated up wider of off-stump, Kishan pushes it wide of cover"
160,Ishan Kishan,Dhananjaya,,full,outside,0,0,0,defend,"Dhananjaya to Ishan Kishan, no run, short but spins away and stays low, Kishan was shaping to cut but ends up stabbing it back down the wicket"
161,Ishan Kishan,Dhananjaya,,full,straight,0,0,0,defend,"Dhananjaya to Ishan Kishan, no run, flatter and bit of extra bounce, Kishan defends it back to DDS"
162,Ishan Kishan,Dhananjaya,,full,straight,0,0,0,defend,"Dhananjaya to Ishan Kishan, no run, quicker and fraction short, Kishan knocks it to the left of DDS"
163,Ishan Kishan,Dhananjaya,,full,outside,0,0,0,defend,"Dhananjaya to Ishan Kishan, no run, slower and on off-stump, Kishan defends with the bat and pad together"
164,Ishan Kishan,Wellalage,,full,straight,0,0,1,drive,"Wellalage to Ishan Kishan, 1 run, floated up outside off, Kishan mistimes the drive to mid-off and sets off, sprints across and makes it in before the ball hits the stumps and deflects away"
165,Ishan Kishan,Wellalage,,full,straight,0,0,0,drive,"Wellalage to Ishan Kishan, no run, drifted across the left hander, Kishan pushes it back to Wellalage"
166,Ishan Kishan,Wellalage,,full,outside,0,0,0,defend,"Wellalage to Ishan Kishan, no run, comes down the track, converts it into a full pitcher and drills it to mid-off"
167,Ishan Kishan,Wellalage,,full,straight,0,0,0,pull,"Wellalage to Ishan Kishan, no run, quicker and attacking the stumps, Kishan blocks in front of mid-wicket"
168,Ishan Kishan,Wellalage,,full,straight,0,0,0,cover drive,"Wellalage to Ishan Kishan, no run, flighted and turning in, Kishan defends solidly back to Wellalage"
169,Ishan Kishan,Dhananjaya,,full,straight,0,0,0,defend,"Dhananjaya to Ishan Kishan, no run, flighted around off, Kishan blocks to the off-side"
170,Ishan Kishan,Dhananjaya,,full,outside,0,0,1,defend,"Dhananjaya to Ishan Kishan, 1 run, tad short and outside off, Kishan cuts square and Nissanka keeps it to a single"
171,Ishan Kishan,Dhananjaya,,full,straight,0,0,0,defend,"Dhananjaya to Ishan Kishan, no run, tosses it up on off, Kishan presses forward and pushes to cover"
172,Ishan Kishan,Dhananjaya,,full,outside,0,0,1,defend,"Dhananjaya to Ishan Kishan, 1 run, flighted around off, Kishan plays it with soft hands towards point and the duo cross over"
173,Ishan Kishan,Wellalage,,full,straight,0,0,1,flick,"Wellalage to Ishan Kishan, 1 run, spinning into leg, Kishan leans forward and nurdles it backward of square"
174,Ishan Kishan,Wellalage,,full,straight,0,0,0,pull,"Wellalage to Ishan Kishan, no run, tad quicker and outside off, Kishan blocks it towards cover"
175,Ishan Kishan,Wellalage,,full,outside,0,0,4,drive,"Wellalage to Ishan Kishan, FOUR, tosses it up invitingly and Kishan takes it on, smacks it straight back over Rahul and long-on has no chance"
176,Ishan Kishan,Wellalage,,full,leg,0,0,0,flick,"Wellalage to Ishan Kishan, no run, spinning from short of length, Kishan blocks to the left of Wellalage"
177,Ishan Kishan,Dhananjaya,,full,straight,0,0,0,defend,"Dhananjaya to Ishan Kishan, no run, loopy delivery on off, Kishan toe-ends the drive back to DDS"
178,Ishan Kishan,Dhananjaya,,full,straight,0,0,1,defend,"Dhananjaya to Ishan Kishan, 1 run, flatter and drifts in, Kishan punches it down to long-on"
179,Ishan Kishan,Dhananjaya,,full,straight,0,0,1,defend,"Dhananjaya to Ishan Kishan, 1 run, more flight and fuller in length, Kishan drives to long-off"
180,Ishan Kishan,Dhananjaya,,full,straight,0,0,0,defend,"Dhananjaya to Ishan Kishan, no run, flatter and slides in, Kishan brings his bat down and keeps it out"
181,Ishan Kishan,Wellalage,,full,straight,0,0,1,cover drive,"Wellalage to Ishan Kishan, 1 run, turns in a long way, Kishan chips it aerially past Rahul and down to long-on"
182,Ishan Kishan,Wellalage,,full,straight,0,0,0,drive,"Wellalage to Ishan Kishan, no run, spins in from outside off, Kishan hangs back and defends"
183,Ishan Kishan,Dhananjaya,,full,straight,0,0,0,defend,"Dhananjaya to Ishan Kishan, no run, sliding into the pads, Kishan tucks it straight to backward square"
184,Ishan Kishan,Dhananjaya,,full,straight,0,0,0,drive,"Dhananjaya to Ishan Kishan, no run, floated up too full, Kishan mistimes the drive to cover"
185,Ishan Kishan,Dhananjaya,,full,outside,0,0,0,defend,"Dhananjaya to Ishan Kishan, no run, flighted outside off, Kishan attempts to cut but can only chop it to the off-side"
186,Ishan Kishan,Dhananjaya,,full,outside,0,0,0,defend,"Dhananjaya to Ishan Kishan, no run, holds the length back, Kishan pushes it off the inner half to mid-wicket"
187,Ishan Kishan,Dhananjaya,,full,straight,0,0,0,defend,"Dhananjaya to Ishan Kishan, no run, drifts in with the angle, Kishan blocks to the left of DDS"
188,Ishan Kishan,Wellalage,,full,straight,0,0,0,cover drive,"Wellalage to Ishan Kishan, no run, wicket maiden, Flighted and turns in, Kishan leans forward and defends to the on-side"
189,Shubman Gill,Wellalage,,full,straight,1,0,0,defend,"Wellalage to Shubman Gill, out Bowled,, Cleaned up, What a ball, Wellalage has produced a jaffa first up to break the partnership"
190,Shubman Gill,Pathirana,,full,outside,0,0,1,flick,"Pathirana to Shubman Gill, 1 run, 142ks full and at the stumps, Gill flicks wide of mid-on and Theekshana makes a diving stop"
191,Shubman Gill,Pathirana,,full,outside,0,0,4,flick,"Pathirana to Shubman Gill, FOUR, no maiden for Pathirana"
192,Shubman Gill,Pathirana,,full,straight,0,0,0,defend,"Pathirana to Shubman Gill, no run, 144ks short and outside off, Gill chops the cut towards cover-point"
193,Shubman Gill,Pathirana,,full,straight,0,0,0,defend,"Pathirana to Shubman Gill, no run, dipping slower ball on leg, Gill digs it out to mid-wicket"
194,Shubman Gill,Pathirana,,full,outside,0,0,0,cover drive,"Pathirana to Shubman Gill, no run, short of length around off, Gill rides the bounce and punches to cover-point"
195,Shubman Gill,Pathirana,,full,outside,0,0,0,defend,"Pathirana to Shubman Gill, no run, 141ks slingy into the pads, Gill clips it straight to square leg"
196,Shubman Gill,Pathirana,,full,straight,0,0,0,cover drive,"Pathirana to Shubman Gill, no run, full delivery on leg-stump, Gill leans forward and gently turns it to mid-wicket"
197,Shubman Gill,Shanaka,,full,leg,0,0,1,flick,"Shanaka to Shubman Gill, 1 run, on a length and outside off, Gill opens the bat face and guides it to third man"
198,Shubman Gill,Shanaka,,full,straight,0,0,0,defend,"Shanaka to Shubman Gill, no run, walks down the wicket and is made to reach for the delivery outside off, knocks it back to Shanaka"
199,Shubman Gill,Shanaka,,full,outside,0,0,0,cover drive,"Shanaka to Shubman Gill, no run, fuller and around off, Gill prods forward and defends to the off-side"
200,Shubman Gill,Shanaka,,full,outside,0,0,1,defend,"Shanaka to Shubman Gill, 1 run, 122ks short of length delivery, Gill plays a controlled cut to deep backward point"
201,Shubman Gill,Shanaka,,full,outside,0,0,0,cover drive,"Shanaka to Shubman Gill, no run, missed out there"
202,Shubman Gill,Shanaka,,full,outside,0,0,0,defend,"Shanaka to Shubman Gill, no run, 124ks fullish delivery around off, Gill works it wristily to mid-on"
203,Shubman Gill,Shanaka,,full,outside,0,0,0,leave,"Shanaka to Shubman Gill, no run, 121ks good length ball on off, Gill prods forward and blocks it back"
204,Shubman Gill,Rajitha,,full,leg,0,0,1,flick,"Rajitha to Shubman Gill, 1 run, on a length and outside off, Gill opens the bat face and guides to third man"
205,Shubman Gill,Rajitha,,full,outside,0,1,1,defend,"Rajitha to Shubman Gill, wide, slower ball sprayed down leg, no chance for Gill to make contact and Kusal Mendis parries it to short fine"
206,Shubman Gill,Rajitha,,full,outside,0,0,2,cover drive,"Rajitha to Shubman Gill, 2 runs, excellent work by Wellalage"
207,Shubman Gill,Rajitha,,full,outside,0,0,4,drive,"Rajitha to Shubman Gill, FOUR, shot, Gill advances down the pitch, makes it into a fullish delivery and lofts through the line over mid-off, couple of bounces and over the rope"
208,Shubman Gill,Rajitha,,full,straight,0,0,0,defend,"Rajitha to Shubman Gill, no run, 137ks back of a length delivery, Gill rides the bounce and knocks it to short cover-point"
209,Shubman Gill,Theekshana,,full,straight,0,0,1,cover drive,"Theekshana to Shubman Gill, 1 run, 98ks flatter and shorter, Gill punches to long-on"
210,Shubman Gill,Rajitha,,full,outside,0,0,1,defend,"Rajitha to Shubman Gill, 1 run, good length ball and stays low, Gill toe-ends the cut past backward point"
211,Shubman Gill,Theekshana,,full,straight,0,0,0,cover drive,"Theekshana to Shubman Gill, no run, 97ks short of length delivery, Gill knocks it back to Theekshana"
212,Shubman Gill,Theekshana,,full,straight,0,0,1,drive,"Theekshana to Shubman Gill, 1 run, 93ks delivery drifts into the pads, Gill nudges to deep square leg"
213,Shubman Gill,Theekshana,,full,outside,0,0,0,cover drive,"Theekshana to Shubman Gill, no run, 90ks carrom ball outside off, Gill defends to cover"
214,Shubman Gill,Rajitha,,full,outside,0,0,2,flick,"Rajitha to Shubman Gill, 2 runs, angled into the pads, Gill flicks it past mid-wicket and gets off the mark with a brace"
